id,title,excerpt,content,createdAt,anonymousSchool,anonymousDepartment,gender,forumName,forumAlias,topics,commentCount,likeCount
239026325,#請益 運動放鬆按摩,目前在職精神科護理師，因為無法輪班時差調不過來想轉職筋膜放鬆按摩。本身有在健身有做筋膜放鬆，剛好老闆說缺人可以試看看，已報名7月底的運動按摩課程證照，想了解筋膜放鬆相關資訊，發現此類資訊少，對未來也很,"目前在職精神科護理師，因為無法輪班時差調不過來想轉職筋膜放鬆按摩。
本身有在健身有做筋膜放鬆，剛好老闆說缺人可以試看看，已報名7月底的運動按摩課程證照，想了解筋膜放鬆相關資訊，發現此類資訊少????
對未來也很迷茫，是否該離開舒適圈轉職",2022-05-29T18:51:39.920Z,FALSE,TRUE,F,健身,fitness,"['運動', '放鬆']",2,1
239026323,各校的帥哥,小弟想請問大家一下關於你們心中帥哥最多的學校，自己是台中人啦.....所以體育大學不用說一定很多，自己再來是私心覺得成大的男生很帥？??（歡迎成大男生底下留言）因為以前有家教是成大的而且顏值真的是不差，,小弟想請問大家一下關於你們心中帥哥最多的學校，自己是台中人啦.....所以體育大學不用說一定很多，自己再來是私心覺得成大的男生很帥？??(歡迎成大男生底下留言)因為以前有家教是成大的而且顏值真的是不差，上一個清大的就..嗯。對,2022-05-29T18:50:59.377Z,TRUE,TRUE,M,彩虹,rainbow,['帥哥'],19,15
239026322,S 場哦 女友有在看。事後說已經買了五顆榴槤了,發現很多女生其實都有在用陪玩，我這樣感覺賺到了欸，不用錢的，另外感謝，這位路人請大家別想太多，直播能去看互動方式在那邊，遊戲而已,"發現很多女生其實都有在用陪玩
我這樣感覺賺到了欸
不用錢的

另外感謝??
這位路人請大家別想太多
直播能去看互動方式在那邊
遊戲而已 

https://i.imgur.com/h7HFrwj.jpg
https://i.imgur.com/woBHAdA.jpg
https://i.imgur.com/dF8g8HI.jpg",2022-05-29T18:50:47.576Z,FALSE,FALSE,M,傳說對決,aov,"['手遊', '射手', '傳說對決', '傳說對決板', '遊戲']",6,2
239026321,徵台南畫眉毛麻豆,我是霧眉師，因為最近準備回去之前學霧眉的老師那邊課程回訓~想在加強練習眉型設計??，如果有不會畫眉毛的人可以來找我畫畫看~??，地點：台南永康（近南應大），時間以晚上為主，時間約1~2小時~，（依據骨骼臉,"我是霧眉師，因為最近準備回去之前學霧眉的老師那邊課程回訓~想在加強練習眉型設計??
如果有不會畫眉毛的人可以來找我畫畫看~??
地點：台南永康（近南應大）
時間以晚上為主，時間約1~2小時~??
（依據骨骼臉型肌肉設計，會調整對稱）
有興趣可以直接私訊我~??",2022-05-29T18:50:43.573Z,FALSE,FALSE,F,美妝,makeup,"['徵', '台南', '畫眉']",2,36
239026320,畢業前的焦慮,不知道有沒有人跟我一樣，好不容易研究所拼到四大，也找好教授了，基本上等著畢業進去實驗室就好，但有時候會莫名的感到焦慮。不知道是不是擔心新環境，或是怕自己能力不夠，好奇大家也會這樣嗎？,不知道有沒有人跟我一樣，好不容易研究所拼到四大，也找好教授了，基本上等著畢業進去實驗室就好，但有時候會莫名的感到焦慮。不知道是不是擔心新環境，或是怕自己能力不夠，好奇大家也會這樣嗎？,2022-05-29T18:50:25.830Z,FALSE,TRUE,F,研究所,graduate_school,"['畢業', '研究所']",23,39
239026317,推薦的酒吧～有想法點進來??,有沒有小仙女推薦一下覺得不錯的酒吧??，我們總共4個人，都剛滿18！，價格不要太昂貴～不限地區都可以??，謝謝願意提供意見的美女們,"有沒有小仙女推薦一下覺得不錯的酒吧??
我們總共4個人，都剛滿18！
價格不要太昂貴～
不限地區都可以??
https://i.imgur.com/QVAqOwK.jpg

謝謝願意提供意見的美女們??",2022-05-29T18:49:55.476Z,TRUE,TRUE,F,女孩,girl,"['推薦', '酒吧']",5,2
239026313,Re: 【文長】淺談不安全感,,此篇文章為轉貼文章，請更新至最新版本觀看完整內容。,2022-05-29T18:49:29.913Z,TRUE,TRUE,F,感情,relationship,[],0,0
239026312,有人想要6/3一起玩環球影城的嗎！,有人想要6/3（星期五）一起去大阪環球影城嗎??，一起拍美照 玩遊樂設施！，會買馬力歐手環～也有的人可以一起來玩，在日本幾乎沒有講中文的朋友（尤其是女生），所以希望可以一起出來玩還能變成朋友?（????????,"有人想要6/3（星期五）一起去大阪環球影城嗎??
一起拍美照 玩遊樂設施！
會買馬力歐手環～
也有的人可以一起來玩?
在日本幾乎沒有講中文的朋友（尤其是女生）
所以希望可以一起出來玩還能變成朋友?(????????)",2022-05-29T18:49:14.294Z,FALSE,FALSE,F,日本生活,japan_life,"['環球影城', '大阪', '日本留學', '旅遊', '交換學生']",11,10
239026310,#徵伴 英國Southampton 轉租資訊,,此篇文章為轉貼文章，請更新至最新版本觀看完整內容。,2022-05-29T18:48:25.550Z,FALSE,FALSE,F,留學,studyabroad,"['轉租', '新生季']",0,0
239026306,出生就是個錯誤,覺得自己被世界遺棄?,覺得自己被世界遺棄?,2022-05-29T18:47:55.441Z,TRUE,TRUE,F,心情,mood,[],3,1
239026304,#問題 徵求申請上首爾大學2022秋季交換的夥伴,希望在韓國可以互相照應～一起相約出去玩??,"希望在韓國可以互相照應～ 
一起相約出去玩??",2022-05-29T18:47:47.325Z,FALSE,FALSE,F,韓國留學,korea_study,"['問題', '徵求', '韓國', '交換學生', '韓國留學']",2,3
239026302,關於名字的稱呼,看了很多動漫一直有個疑問，日本人是用什麼依據來決定要叫姓還是名字的呢？常看到可能從小就認識的好朋友是叫彼此姓，頂多把姓簡稱（例如研磨叫黑尾小黑、山口叫月島月），不太熟或有一些階級差距的（像是學長）卻叫,"看了很多動漫一直有個疑問
日本人是用什麼依據來決定要叫姓還是名字的呢？
常看到可能從小就認識的好朋友是叫彼此姓
頂多把姓簡稱（例如研磨叫黑尾小黑、山口叫月島月）
不太熟或有一些階級差距的（像是學長）卻叫名字
是怎麼分的呀～～

突然想到
還有宮侑第一次在球場上遇到就叫翔陽名字
我那時候還倒回去確認！

以上以排球少年為例
但很多部都有發現這個情形",2022-05-29T18:47:33.906Z,FALSE,TRUE,F,動漫,acg,[],4,0
239026296,手把,這邊有人有玩手把的嗎？想了解一下手把該買哪種的會比較適合，最近想嘗試手把來玩玩看 但不知道怎麼選還有一些想的注意事項想問一下有沒有 人能幫我解答一下，還有呀想問鍵鼠與手把的優缺點差別～～｜謝謝,"這邊有人有玩手把的嗎？ 
想了解一下手把該買哪種的會比較適合 
最近想嘗試手把來玩玩看 但不知道怎麼選還有一些想的注意事項想問一下有沒有 人能幫我解答一下
還有呀想問鍵鼠與手把的優缺點差別～～｜
謝謝",2022-05-29T18:46:35.660Z,FALSE,TRUE,M,APEX 英雄,apex_legends,['手把'],6,0
239026295,#尋文 感情中如何找回自我的好文,首po有任何不周請見諒??，最近感情遇到了一些瓶頸，變成一個極度沒有安全感也自卑的人，想重溫一篇文給自己一些力量，內容大概是，女方一開始很黏男方，男方受不了於是提出暫時分開（or不聯絡），女方雖心痛也不,"首po有任何不周請見諒??

最近感情遇到了一些瓶頸，變成一個極度沒有安全感也自卑的人，想重溫一篇文給自己一些力量

內容大概是
女方一開始很黏男方，男方受不了於是提出暫時分開（or不聯絡），女方雖心痛也不得不答應
接下來的日子裡，女方很努力充實自我並找回自信，發覺自己一個人也過得很好
結尾男方找女方出來談談，女方表示自己好像再也不需要男方了，男方很著急地嘗試挽回卻無果（男方好像說了一句「你不愛我了嗎」）
大概是這樣！

拜託如果有人有印象而且有存起來的話
可以告訴我嗎??
那篇文真的超級勵志，當時給了我很多力量，如果找得到那篇文的話，我覺得我能更有動力繼續向前
拜託大家了
https://sticker-assets.dcard.tw/images/3f8135cb-c935-4885-ac6d-dd6756cf7f82/orig.png",2022-05-29T18:46:19.355Z,TRUE,TRUE,F,感情,relationship,"['感情', '分手', '尋文']",2,4
239026294,問處女男??,文有點長，抱歉，正題，跟處女男曖昧快三個月，一開始都好好的，對方講話也都會撩，一小段時間後我朋友有偷偷問他有沒有喜歡我、有喜歡為什麼不在一起，他的回答是：有喜歡但喜歡不一定要在一起，後來相處久之後他的,"文有點長，抱歉??

正題

跟處女男曖昧快三個月
一開始都好好的，對方講話也都會撩
一小段時間後我朋友有偷偷問他有沒有喜歡我、有喜歡為什麼不在一起
他的回答是：有喜歡但喜歡不一定要在一起
後來相處久之後他的脾氣就越來越不好，常常都在嘴我，反正嘴巴很壞

我們聊天方式都是用電話，如果是訊息的話他看心情回但通常都不讀不回
因為他工作蠻忙的，所以一天之中可能只有晚上有時間講上幾句
前天講電話講到一半聽到訊息聲，他就問我是誰傳訊息，抓到什麼的
有時候他也會突然說：好久沒看到你了，開視訊、或者直接開視訊要我也開，

工作關係之前是每天都可以掛睡的，現在換了所以只剩假日休息才會掛睡
一開始掛睡是他要求的，後來我們就養成這種習慣
有時候放假的白天如果沒事他會打給我，我們會一起打個遊戲、互嘴，甚至是他做他的事我忙我的事
晚上有可能他會去找朋友，一直到凌晨3-4點到家會打電話給我，講個幾句然後掛睡
只要他在忙，就是會直接消失好久，這個我也已經很習慣了??

有一次發生爭執（因為他要掛睡，我那時候說了掰掰，他又確認一次我是掰掰的就掛掉了）
隔天開始那整個禮拜他就變得很冷，我們每天聊天大概只有1-2分鐘，甚至幾秒，到了禮拜五那天他只有利用中午那短暫的休息時間打給我跟我聊一下後一直到隔一天都沒在出現過
後來我受不了跟他說：你已經過了33個小時不理我，是不是不想跟我講話
他那時候跟朋友在外面只回我：累啊
我：好
那天他一樣凌晨到家打給我，我們聊了一下，雖然沒什麼內容，後來他要求開視訊
我：不要
他：給你五秒考慮（5、4??1）
我：如果我說不要呢
他立馬把電話掛掉
隔天早上他起床後又打給我，我們就跟往常一樣講個話、做自己的事、嘴砲
在後來的禮拜因為需要自主健康管理所以他都在家，那個禮拜幾乎每天都是跟他在講電話，一天平均5-6通

上禮拜我限時發了一篇把妹的東西
他就回我限時叫我教他
我：你不行
他：為什麼
我：因為你已經很會把妹了
他：哪有，我又把不走你
我：有啊，你已經在我心裡了
他：你別騙
我：才沒有騙你
他：好喔（他很愛這樣敷衍我）
我：敷衍的人
他：……..
這樣我是要理解成他在釣我，還是在丟球

前兩天，他凌晨2點到家打給我，我們一起打遊戲，後來我跟他說我晚點要去我同學家喝酒（他也去過，甚至我前一天就有先說也邀約他）
結果他就莫名生氣了，後來凌晨4點多我到朋友那問他睡了嗎，再來又是消失的一整天，到晚上9點才回我睡了，之後又跟朋友出去唱歌喝酒
大概凌晨4點多打給我，他喝有點多我聽不太懂他在說什麼，後來直接掛睡，早上起床後我有問他為什麼生氣，原本我一直以為是因為沒陪他打完遊戲在不爽，但他說不是，其實也有猜是因為我去喝酒在不開心但是我不知道他的點是什麼，問了好久也問不出來，脾氣又差又怕問下去他覺得煩

前面說過，如果晚上沒事我們就會掛著電話聊天最後掛睡，如果他有約就會出門到凌晨回家打給我，隔天早上起床再繼續聊，最近多了他會自己跟我說他幹嘛去了，或者故意問我說，你知道我昨天去哪嗎，要我去猜然後他在輔助解答，然後要睡覺會催促我睡，如果我還不想睡就會一直重複講要睡了沒直到我答應他要睡覺了
目前大概是這樣，文有點亂抱歉?????♀?

最後想請問

要怎麼讓對方說出生氣的點（每次只要問，他總是不說，我也猜不到）

一開始說喜歡又不一定要在一起，後來又說把不走我，也太矛盾了
這樣是有想進一步還是只是釣著我，他的忽冷忽熱到讓我有點失去自己，因為前面那樣講我也不敢直接丟直球，該下船了嗎?_?

最最後，男生要女生叫他爸爸到底是什麼意思（好怪的問題哈哈）

對了
我們總共見過四次面
上個禮拜我朋友在旁邊提到電影，他就約我要出去看電影，只是後來沒再討論就不了了之了。",2022-05-29T18:46:15.427Z,TRUE,TRUE,F,星座,horoscopes,"['問', '處女', '曖昧']",7,3
239026290,#iPad 到貨時間,想問一下官網訂的話到貨時間會延遲嗎？假如直接去直營店買一定有貨嗎？-，因為我在家裡附近的studio a 等了一個月都還沒有貨，所以想問一下版上的大家謝謝,"https://i.imgur.com/Tab5arp.jpg
想問一下官網訂的話到貨時間會延遲嗎？
假如直接去直營店買一定有貨嗎？
-
因為我在家裡附近的studio a 等了一個月都還沒有貨
所以想問一下版上的大家謝謝????",2022-05-29T18:45:32.432Z,FALSE,FALSE,F,Apple,apple,"['iPad', 'Apple']",4,3
239026288,#討論及疑問 大家想像中的魔法世界物品,大家看哈利波特小說時，應該會想像一下魔法世界裡面的東西吧？結果電影裡卻不是長得像你想的那樣，比如說我想像中的檸檬雪寶??，我一直以為類似小點心類的東西，因為小說裡鄧不利多一直想將他們掰開，結果是糖果??,"大家看哈利波特小說時
應該會想像一下魔法世界裡面的東西吧？
結果電影裡卻不是長得像你想的那樣
比如說我想像中的檸檬雪寶??
https://i.imgur.com/QhZmRki.jpg
我一直以為類似小點心類的東西
因為小說裡鄧不利多一直想將他們掰開
結果是糖果??
https://i.imgur.com/EpPciOZ.jpg
（圖片都是網路上抓取）
大家有沒有類似的情況呢??
一起來分享一下吧！",2022-05-29T18:45:18.198Z,FALSE,TRUE,F,哈利波特,harry_potter,['哈利波特'],12,22
239026287,貓咪愛爬到間接照明，又有咬電線的前科，會不會電線走火啊?,最近剛搬回家裡，幾年前有做間接照明，沒想到帶回來的貓咪居然輕輕鬆鬆就上去了還不肯下來。平常我那邊的燈是沒在開的啦，但還是會怕她去咬電線，畢竟有咬壞好幾條充電線的前科?，不知道這種電線平常沒開的話，被咬,"最近剛搬回家裡，幾年前有做間接照明，沒想到帶回來的貓咪居然輕輕鬆鬆就上去了還不肯下來。
平常我那邊的燈是沒在開的啦，但還是會怕她去咬電線，畢竟有咬壞好幾條充電線的前科?
不知道這種電線平常沒開的話，被咬壞是會有電線走火的風險嗎？
https://i.imgur.com/GXMIW5J.jpg",2022-05-29T18:45:15.398Z,FALSE,TRUE,M,寵物,pet,"['貓咪', '電線', '火災']",3,1
239026283,#請益 克蘭詩-黑頭掰掰淨化面膜,請問有人用過克蘭詩的這款「黑頭掰掰淨化面膜」嗎？看官網說明好像蠻厲害的 感覺也不會很刺激，但是官網評論數非常少 低卡和批踢踢也沒有人討論過這個產品 所以上來問問大家的心得！,"請問有人用過克蘭詩的這款「黑頭掰掰淨化面膜」嗎？看官網說明好像蠻厲害的 感覺也不會很刺激
但是官網評論數非常少 低卡和批踢踢也沒有人討論過這個產品 所以上來問問大家的心得！
https://i.imgur.com/x2DN0ux.jpg",2022-05-29T18:43:37.520Z,FALSE,TRUE,F,美妝,makeup,"['克蘭詩', '黑頭', '保養']",3,44
239026282,交友軟體,哈囉大家好 小弟最近開始玩交友軟體 昨天晚上遇到了一個女生 他直接問我是單身嗎 跟我說她單身 要找男朋友 問我你也是嗎，然後我們就繼續聊下去 後來他說如果之後我們在一起 會常常想要愛愛 能滿足他嗎 我,"哈囉大家好 小弟最近開始玩交友軟體 昨天晚上遇到了一個女生 他直接問我是單身嗎 跟我說她單身 要找男朋友 問我你也是嗎
然後我們就繼續聊下去 後來他說如果之後我們在一起 會常常想要愛愛 能滿足他嗎 我想說哇塞也太快了吧
之後他叫我註冊一個網站 叫melotw （很像是大陸網站）說想要跟我在上面聊 但是那個網站要錢 講沒兩句叫一直跳出購買的頁面
他一直教我買 說要用那個跟我聊 我問他賴 ig不好嗎 他都一直不要 說用賴很多主管 工作群組 之前差點丟工作
IG又說會被騷擾 請問這樣是詐騙嗎
總覺得不是很安心 謝謝大家的回覆",2022-05-29T18:43:30.241Z,TRUE,TRUE,M,感情,relationship,"['交友', '軟體']",7,0
239026280,怎麼樣判斷對方的意思,跟對方相處一年多，因為是同學的關係，所以幾乎常常都會在一起，常常下課之後一起讀書，而且對方常常會因為我跟其他女生互動不開心，之前心情不好的時候還跟我說如果沒有我陪在她身邊，她早就放棄之類的話，可是又常,跟對方相處一年多，因為是同學的關係，所以幾乎常常都會在一起，常常下課之後一起讀書，而且對方常常會因為我跟其他女生互動不開心，之前心情不好的時候還跟我說如果沒有我陪在她身邊，她早就放棄之類的話，可是又常常說要幫我找女朋友，有時候還會突然隱身耍自閉，請問這樣的關係到底是什麼？?????? 每次都被搞到不清楚狀況了??,2022-05-29T18:43:11.191Z,TRUE,TRUE,M,感情,relationship,"['曖昧', '感情']",3,0
239026277,如果說青春是一場雨，那我的大概是暴風雨,第一次在 Dcard 發文，其實當年就好想用這樣的方式記錄下來，過了這麼久，總覺得是時候讓它留下一些痕跡了。那是發生在一所大學，大家青春揮灑的 20 歲，當時我們誰也沒想過，很要好的你們、很要好的我們,,2022-05-29T18:42:42.107Z,TRUE,TRUE,F,感情,relationship,"['青春', '感情']",1,2
239026275,統測用書請益,大家好，我是112電機類的統測考生，想要趁暑假趕快準備，目前基礎比較差，想問今年學長姐新課綱有什麼推薦的專業科目還有數C的講義，希望是前面解釋的較詳細的，目標臺、北科電資，謝謝大家,大家好，我是112電機類的統測考生，想要趁暑假趕快準備，目前基礎比較差，想問今年學長姐新課綱有什麼推薦的專業科目還有數C的講義，希望是前面解釋的較詳細的，目標臺、北科電資，謝謝大家??,2022-05-29T18:42:19.107Z,FALSE,TRUE,M,新生季,freshman,"['統測', '用書', '請益', '新生季']",0,0
239038208,長庚科大護理系甄試總成績,想請問長庚科大護理系（林口校區）的學長姐們，請問甄試總成績71.09可以錄取護理系嗎,"想請問長庚科大護理系（林口校區）的學長姐們
請問甄試總成績71.09可以錄取護理系嗎",2022-05-31T04:50:13.084Z,FALSE,TRUE,F,新生季,freshman,"['長庚', '護理']",4,0
239038205,兩歲兒童重症亡，這位爸爸好無助,,https://youtu.be/RyZ2BtILT_s,2022-05-31T04:49:36.801Z,FALSE,TRUE,M,時事,trending,"['疫情', 'COVID19', '台灣', '武漢肺炎', '時事']",3,2
239038201,爸爸的三萬元,爸爸，那天轉了3萬元給我，爸爸因?擔心疫情，不讓我去群聚運動，為此，我很生氣的說，不然我搬出去住，晚上爸爸來我的房間，跟我說他擔心全家人的健康，他不想我搬出去，其實，我都懂，爸爸低頭的樣子，現在想想，,"爸爸
那天轉了3萬元給我

爸爸因?擔心疫情
不讓我去群聚運動

為此
我很生氣的說
不然我搬出去住

晚上爸爸來我的房間
跟我說他擔心全家人的健康
他不想我搬出去

其實
我都懂
爸爸低頭的樣子
現在想想
也覺得自己真的很不孝

可是
我的心裡破了一個洞
我不能把自己封閉起來

我沒有
在父母面前掉眼淚
就是不想他們擔心

我知道
我病了

為了父母
為了小孩

我需要更堅強
可是真的好累

明明很疼
卻要像平常一樣生活

加油，米樂。",2022-05-31T04:48:52.663Z,FALSE,TRUE,F,心情,mood,[],4,2
239038200,轉學考 輔大vs東吳vs淡江,想問一下 我目前輔大跟東吳已經報名了，但是淡江還沒，就想問一下若三間轉學成功的話 ，會推薦我去哪？,"想問一下 我目前輔大跟東吳已經報名了，但是淡江還沒
就想問一下若三間轉學成功的話 ，會推薦我去哪？",2022-05-31T04:48:51.832Z,FALSE,TRUE,M,閒聊,talk,"['轉學', '輔大', '東吳']",3,0
239038198,#發問 Dunk 煙灰色,小妹對球鞋不是很了解，但想買dunk也有一段時間了，有在臉書的一些球鞋社團（如：球鞋交易中、球鞋公社、二社等等）找一樣的鞋款，卻找不到一樣的配色 ，上蝦皮找了下清一色也都是灰白，但這ig賣家也有12.,"小妹對球鞋不是很了解，但想買dunk也有一段時間了，
有在臉書的一些球鞋社團（如：球鞋交易中、球鞋公社、二社等等）找一樣的鞋款，卻找不到一樣的配色 ，
上蝦皮找了下清一色也都是灰白，
但這ig賣家也有12.2萬粉絲，不像會賣假貨的帳號，
（也可能是我關鍵字搜錯：dunk 灰、煙灰、灰黑等等）
想上來問看看大家dunk是否真的有這顏色呢？
https://i.imgur.com/NIprraM.jpg",2022-05-31T04:48:38.794Z,FALSE,FALSE,F,球鞋,sneakers,"['dunk', '灰色', '鞋子', '球鞋', 'Nike']",12,6
239038196,腎興or藻護腎,貓貓cre 2.09醫生只說多喝水 吃低磷罐就好，醫生有推薦腎興 我自己爬文看比較多人推的是藻護腎，腎興比較沒什麼討論但用的人好像也不少，想請問對二者有比較了解或是多年腎貓照護經驗的版友對二者的評價，,"貓貓cre 2.09醫生只說多喝水 吃低磷罐就好
醫生有推薦腎興 我自己爬文看比較多人推的是藻護腎
腎興比較沒什麼討論但用的人好像也不少
想請問對二者有比較了解或是多年腎貓照護經驗的版友對二者的評價
謝謝",2022-05-31T04:48:17.833Z,FALSE,TRUE,F,寵物,pet,['貓'],2,1
