id,title,excerpt,content,createdAt,anonymousSchool,anonymousDepartment,gender,forumName,forumAlias,topics,commentCount,likeCount
238955238,無法接受朋友嫁給工人,我和閨蜜a家境都算不錯，我們倆從小就讀知名國際學校，朋友圈也都差不多，大家也常常帶另一半出來玩，因為剛好前一段時間我在趕研究所畢業論文加上疫情，所以有一段時間沒有跟朋友聚會好好聊天，上個月a突然打給我,"我和閨蜜a家境都算不錯
我們倆從小就讀知名國際學校
朋友圈也都差不多
大家也常常帶另一半出來玩
因為剛好前一段時間我在趕研究所畢業論文加上疫情
所以有一段時間沒有跟朋友聚會好好聊天
上個月a突然打給我說她懷孕了 要登記結婚
然後她男友是個工地的工人
我一開始蠻震驚的（畢竟跟我們的生活圈完全沒有交集）
問她她父母有說什麼嗎
她說：一開始她父母反對，但是她男友很man，說只要把她肚子搞大，她父母就算反對也只能接受了！果然懷孕了他父母也只能點頭，但不准他們住在家裡
……
好喔我實在不懂為何這樣很man？?
不過既然她都決定了人家父母也沒說話
那我也不方便多說些什麼
就還是祝福
問題來了
自從a上個月和她的工人老公結婚後
莫名認識了一堆+9妹（她老公朋友的女朋友或老婆）
之前朋友們聚餐 她也帶了那些+9妹朋友一起來
吃飯期間滿嘴髒話就算了，吃到一半還會把腳跨在桌子上，頭髮染成彩色的，妝濃的不可思議搭配驚悚的放大片，甚至還穿著品牌根本沒出過的假貨
a也變得很能融入他們了….
雖然當下大家都還是有做做樣子禮貌性陪笑
但就感覺我們是不同世界的人啊
反正後來其他朋友們也說好之後聚會都不會約
a了
可是因為a和我真的互相陪伴彼此好多年了
我應該提醒她要她遠離那些+9妹
還是乾脆就割捨我們的友誼慢慢遠離她了
？
如果是你們會怎麼做呢",2022-05-21T23:12:48.710Z,TRUE,TRUE,F,心情,mood,[],10,3
238955235,看熱鬧的小孩撿角,如題，最近還多廟會活動，無意間聽到身邊的長輩說，看熱鬧的小孩這輩子真的撿角，我心裡想說，小朋友只是好奇而已，應該不用這樣說…..,如題，最近還多廟會活動，無意間聽到身邊的長輩說，看熱鬧的小孩這輩子真的撿角，我心裡想說，小朋友只是好奇而已，應該不用這樣說…..,2022-05-21T23:11:00.194Z,FALSE,TRUE,F,閒聊,talk,"['廟會', '閒聊', '台灣', '時事', '生活']",1,0
238955232,渣男,,此篇文章為轉貼文章，請更新至最新版本觀看完整內容。,2022-05-21T23:08:42.014Z,TRUE,TRUE,F,感情,relationship,"['渣男', '新竹', '感情', '交友軟體', '女孩']",4,4
238955231,男生都愛臭婊子,臭婊男生平常罵歸罵，其實還是最喜歡這種的吧，不然為什麼男友一邊說，我是很乖很棒的女生，一邊跟到處釣狗公找工具人的臭婊子好上了，交往4年，任勞任怨做家事，除了生日不過節，生日也都是我在送他手機什麼的，他,"臭婊男生平常罵歸罵
其實還是最喜歡這種的吧
不然為什麼男友一邊說
我是很乖很棒的女生
一邊跟到處釣狗公找工具人的臭婊子好上了
交往4年
任勞任怨做家事
除了生日不過節
生日也都是我在送他手機什麼的
他只請我吃個飯還總是差點忘記我的生日
從來也沒要求過他任何事情任何東西
每天晚上抱著說有多愛我
結果轉頭在手機跟臭婊子聊色情
還跟她抱怨我奶不夠大不夠騷沒有情趣
上個月被我發現要跟他分手
結果說啥只是喜歡她的body
但是我拒絕
就惱羞說不想跟我這種老媽子過了
後來聽說分手後
他馬上找臭婊子要求在一起
結果人家根本不屌他
前天520前男友辦小帳在那邊求我
笑死人了
有些女生會變成臭婊子只能怪你們男生
因為你們喜歡
交往2任都以這種形式告終
傻子才當乖女孩
我要來去釣狗公了",2022-05-21T23:08:29.196Z,TRUE,TRUE,F,感情,relationship,[],5,5
238955230,#開箱 NARUKO茶樹抗痘粉刺寶-消腫痘救星?,這是我第一次用牛爾粉刺寶，使用第一天就很有感，我是直接塗抹全臉，下巴痘痘就直接冒出頭並且直接消腫，後面幾天有繼續擦，整個臉油光變少，而且還變亮的感覺，使用起來質地很清爽而且涼涼的，到第三天的時候我就使,,2022-05-21T23:08:22.929Z,FALSE,FALSE,F,美妝,makeup,"['開箱', '茶樹', '保養', '抗痘']",1,45
238955222,早安安各位,求凱瑞????，最近一直連輸，目前掉到星耀三，希望能帶我上分，我走中射（但不強！，不要嘴我都來,"求凱瑞???♀?
最近一直連輸
目前掉到星耀三
希望能帶我上分
我走中射（但不強！
不要嘴我都來",2022-05-21T23:03:34.525Z,FALSE,TRUE,F,傳說對決,aov,['傳說對決'],3,1
238955221,#活動 尋找美睫麻豆 大量收集特殊款式作品,??10年美睫資歷??，費用：免費，款式：仙女睫毛（鳳尾蝶）、四葉草爆濃款、各類特殊款，地點：高雄市三民區，時間：5/23 10：30 & 12：30（其他時段私訊詢問），時長：1.5-2小時（非新手，不,"??10年美睫資歷??
費用：免費
款式：仙女睫毛（鳳尾蝶）、四葉草爆濃款、各類特殊款
地點：高雄市三民區
時間：5/23 10:30 & 12:30（其他時段私訊詢問）
時長：1.5-2小時（非新手，不需久躺）
??收集累積特殊款式作品照
??需配合拍照、追蹤、分享、評論
??勿遲到臨時取消
??操作當天勿上妝、需配戴有色隱眼
??如需卸睫+200
??半年內無眼部手術、眼疾患者
??三個月內施作角蛋白者不適
??兩個月內施作眼線不適
??公主病完美主義者不適
??禁止攜伴
填單報名??????????
https://docs.google.com/forms/d/e/1FAIpQLSfvSr3FcAxk6gZFiwXWuVTBzDti2dqeTtL4Rb751weXXNH3WQ/viewform?vc=0&c=0&w=1&flr=0

https://i.imgur.com/GFdtHy3.jpg",2022-05-21T23:02:48.831Z,FALSE,FALSE,F,美妝,makeup,"['美睫', '麻豆', '尋找', '徵', '免費']",3,47
238955217,兄弟們 快追鴨！,,https://megapx-assets.dcard.tw/videos/bedf3a3d-2ab7-4e60-b8e3-ff74104ab3d8/orig,2022-05-21T23:01:24.054Z,FALSE,TRUE,F,有趣,funny,[],2,28
238955214,男人真的只喜歡長頭髮女人嗎？,男人真的只喜歡長頭髮女人嗎？短頭髮女人就不行嗎？這是什麼迷思？！，短頭髮也是很有魅力的，還是男人都認為一定是女同嗎？誰規定女人不可以短頭髮的！,"男人真的只喜歡長頭髮女人嗎？
短頭髮女人就不行嗎？
這是什麼迷思？！
短頭髮也是很有魅力的
還是男人都認為一定是女同嗎？
誰規定女人不可以短頭髮的！",2022-05-21T22:58:25.167Z,FALSE,FALSE,F,閒聊,talk,"['女生', '閒聊', '髮型意見', '有趣']",10,0
238955213,陳怡蓉的演技算好嗎,最近在看翻牆的記憶，看到陳怡蓉的片段就覺得很尷尬，表情好像一直都是那樣，尤其是講台詞的時候，真的超級無敵出戲，跟聲音應該沒關係，應該是語調的問題，非常的飄然，一聽就覺得這個人絕對是在背台詞，但是她卻好,"最近在看翻牆的記憶
看到陳怡蓉的片段就覺得很尷尬
表情好像一直都是那樣
尤其是講台詞的時候
真的超級無敵出戲
跟聲音應該沒關係
應該是語調的問題
非常的飄然
一聽就覺得這個人絕對是在背台詞
但是她卻好像演過很多女主欸
雙城記還有加油吧什麼的忘記了一個女議員的
看她上節目表現的時候覺得很自然很討喜
但真的不懂她的演技
可能只有我覺得吧
https://sticker-assets.dcard.tw/images/e065241a-e07b-4703-a8fe-7d8776ff624b/orig.png",2022-05-21T22:58:12.950Z,FALSE,TRUE,F,閒聊,talk,"['演技', '陳怡蓉']",1,0
238955212,雙子、摩羯疑惑 內有匿名群組，可閒聊 提問 交友。,以下群組可以讓正在為雙子困擾的妳（你），得到不同雙子的解答。想了解更多雙子，或是想追雙子，想得到更多不同解答，可以加入下方LINE群，裡面有很多雙子願意解答各位的問題 想法 做法 閒聊，也可以交到許多,"以下群組可以讓正在為雙子困擾的妳（你），得到不同雙子的解答。

想了解更多雙子，或是想追雙子，想得到更多不同解答，可以加入下方LINE群，裡面有很多雙子願意解答各位的問題 想法 做法 閒聊，也可以交到許多朋友，麻煩大家了。


下方連結可以將妳（你）帶往匿名群組

https://line.me/ti/g2/7B58ihgQn18x0_kuyh5aaW7L6joaVbO_77OGEw?utm_source=invitation&utm_medium=link_copy&utm_campaign=default

另外??????????

以下群組可以讓正在為摩羯困擾的妳（你），得到不同摩羯的解答。

想了解更多摩羯，或是想追摩羯，想得到更多不同解答，可以加入下方LINE群，裡面有很多摩羯願意解答各位的問題 想法 做法 閒聊，麻煩大家了。


下方連結可以讓你們找到通往回家（新家）的路。

https://line.me/ti/g2/EY-9aszmsPFdEYmDZHyhSH3Q17yVzI3MHW5FuQ?utm_source=invitation&utm_medium=link_copy&utm_campaign=default",2022-05-21T22:58:09.928Z,TRUE,TRUE,M,星座,horoscopes,"['雙子', '摩羯', '疑惑', '感情', '愛情']",0,0
238955211,#請益 #健身器材#請益#啞鈴,想請問 有人知道照片中的槓片，是哪一個牌子廠家？多年前買的，現在想加更重,"想請問 有人知道照片中的槓片
是哪一個牌子廠家？
多年前買的
現在想加更重
https://i.imgur.com/9KqltdS.jpg
https://i.imgur.com/rL2K3XL.jpg",2022-05-21T22:58:03.342Z,FALSE,FALSE,M,健身,fitness,"['健身器材', '啞鈴', '重訓', '健身']",3,0
238955210,#討論 婚戒挑選及售後服務重要嗎？,因為男友沒在戴戒指，所以他打算不買他的婚戒，後來我們就講好買一個婚戒 我戴就好，（我從小就很憧憬這件事 所以很想要一個婚戒），預算大概落在兩萬到四萬，我是要找個日常能配戴的婚戒，不喜歡太閃耀浮誇的鑽，,"因為男友沒在戴戒指
所以他打算不買他的婚戒
後來我們就講好買一個婚戒 我戴就好
（我從小就很憧憬這件事 所以很想要一個婚戒）
預算大概落在兩萬到四萬

我是要找個日常能配戴的婚戒
不喜歡太閃耀浮誇的鑽
目前試戴過覺得能接受到最大顆的鑽就到17分
（雖然我不知道17分也能叫做鑽嗎??）
主要喜歡戒台加上小鑽的整體設計和配戴的感覺
簡約的設計又不會太普通
而且由於我的手指比較細（最小的尾戒能戴到無名指）
所以偏好細一點的戒指 但不要線戒
由於本人認為婚戒是戴一輩子的 沒有要賣掉
所以不考慮黃金 想要不太會變色的鉑金材質
但看到板上有人把鉑金戴到變形
還是對鉑金心存疑慮……

有稍微看過文章推薦的品牌
但因為我覺得我買的不是大顆的鑽石
所以應該比較著重在售後服務吧？
畢竟這是我第一個比較貴的飾品
平常沒在戴飾品 很怕被粗魯的我弄壞
然後看到有人戴的婚戒在日常生活中很小心保護
但旁邊的小碎鑽還是掉過兩次
結果送去櫃上還要被收取工本費
我看她是說原本說好這個售後服務是免費的
結果被銷售員說這是人為疏失需要收取費用
對於很粗魯的我而言感覺掉鑽這件事需要考慮進去

我有去過百貨公司的幾個日系品牌和外面的銀樓
像是銀座白石有終身免費清洗和改戒圍
銀樓是一次免費清洗跟一次免費改戒圍
但其實我也不清楚人的一生中改戒圍的頻率高嗎？
或者戒指有需要經常清洗嗎？
這些售後服務使用率高嗎？

想問有買婚戒的人戴了幾年後 你們覺得
你們覺得戒指買喜歡的就好 售後服務使用率不高
還是其實售後服務非常重要？
相對日系品牌 銀樓的售後服務會不會不好？
終身免費跟一次性免費會差異很多嗎？

還有我想問一下有人去外面訂製過婚戒嗎？
不是很清楚訂製流程
但是我怕一開始只有草稿圖可以看
沒有實際的成品和戴在手上的感覺
怕做出來後才覺得不適合自己
還有成品的做工是否品質不一
這樣風險是不是很大？

如果以我的需求來講要選日系品牌、銀樓、訂製哪個比較適合？",2022-05-21T22:57:26.758Z,TRUE,TRUE,F,結婚,marriage,"['討論', '婚戒', '挑選', '結婚', '女孩']",10,13
238955207,開不起玩笑？,認識一年的室友不只一次，跟我開了胸部大小的玩笑。：哈哈哈part time做包子 笑死，：真勤勞 放假還得做parttime，：必須把自己養成包子，：你現在屬於小饅頭 ?離包子反正差點意思 哈哈哈哈，,"認識一年的室友不只一次，跟我開了胸部大小的玩笑。

??：哈哈哈part time做包子 笑死
??：真勤勞 放假還得做parttime
??：必須把自己養成包子
??：你現在屬於小饅頭 ?離包子反正差點意思 哈哈哈哈
??：？？？ 禁止人身攻擊 你這小竹籤
??：哈哈哈哈哈 你見過咋的 我可是能看見
??：其實這並不好笑 就有點那啥 好吧 並不想被關注這東西 請把眼睛移開 感恩啊
??：好吧 我錯了我道歉

（上面我說的包子是指，要把自己養成包子臉）

我男閨蜜和玩的很好的男性朋友都沒跟我開過這種玩笑，該說這個人沒品嗎？

個人覺得這只屬於「女性之間的玩笑」
男生說這個真的就跟你長的醜、胖、矮一樣具有攻擊力。",2022-05-21T22:54:33.877Z,FALSE,FALSE,F,閒聊,talk,"['感情', '閒聊', '女生', '交友', '朋友']",5,0
238955202,令人傻眼的猴子,老實說我很意外都什麼時代了，怎麼還有人可以這麼沒教養。八成覺得這種事情燒一下就沉下去也沒人記得他們幹嘛了吧？,"老實說我很意外都什麼時代了，怎麼還有人可以這麼沒教養。
八成覺得這種事情燒一下就沉下去也沒人記得他們幹嘛了吧？",2022-05-21T22:51:55.395Z,TRUE,TRUE,F,心情,mood,"['轉發', '傻眼', '猴子', '時事', '靠北']",1,1
238955199,母胎求幫忙????,認識的女生朋友跟我說她有朋友想認識我，給了ig 互相追蹤 沒見過面沒聊過天，她都會對我的限時按讚或回表情，也常常第一個看限時，可是她感覺沒打算主動開啟話題聊天，興趣相同 她喜歡陽光 高 手控 真誠 的,"認識的女生朋友跟我說她有朋友想認識我
給了ig 互相追蹤 沒見過面沒聊過天
她都會對我的限時按讚或回表情
也常常第一個看限時

可是她感覺沒打算主動開啟話題聊天
興趣相同 她喜歡陽光 高 手控 真誠 的人
不想錯過這次機會
但我真的不知道怎麼開始聊天

第一句：嗨！
是可以的嗎??
對沒見過面也不認識的人要怎麼開話題
來自母胎即將21年的可憐單身狗
真誠的詢問",2022-05-21T22:50:27.413Z,TRUE,TRUE,M,感情,relationship,['感情'],6,1
238955196,有沒有人也遇過類似我這樣的問題??,,此篇文章為轉貼文章，請更新至最新版本觀看完整內容。,2022-05-21T22:45:54.960Z,FALSE,TRUE,M,感情,relationship,['請你一定要比我幸福'],0,0
238955195,RO: 魔物遠征 25-24 隊伍分享,這關卡好久 應該有兩個多小時...，隊伍組合，（ 這個組合也刷了十幾次才成功，每次都差一點（-ι_- ），站位，配置思路，坦 除了用獸人國王外 另外再搭配俄塞里斯，主要靠他的技能把敵人弄在一起，能夠在,"這關卡好久 應該有兩個多小時...

隊伍組合
https://i.imgur.com/0JUJ8ud.jpg
（ 這個組合也刷了十幾次才成功，每次都差一點(-ι_- )

站位
https://i.imgur.com/DzW1kZa.jpg

配置思路
坦 除了用獸人國王外 另外再搭配俄塞里斯
主要靠他的技能把敵人弄在一起
能夠在場上撐越久越好
https://i.imgur.com/Z1KYlUR.jpg

補的話 我是選擇用天使波利
治療量的話還是它比較多 也比較能夠即時補給

攻擊 
神射手迪文 我覺得是必備的
一樣是斷敵人招 再加上也有很好的輸出
在俄塞里斯放招 敵人聚在一起時 再一起放招
全體可以吃到不少傷害

主角職業 這次也改用煉金術師
通常在俄塞里斯放完招後 奧義也跟著好
這個時候可以給對方很多傷害


-------?-----------------------
原本配置
補原本用光補，職業用吟遊詩人
打到剩50秒敵人都殘血
但每次都先把對面的光補殺掉
另外四隻血一起回滿囧(-ι_- )",2022-05-21T22:45:07.251Z,FALSE,FALSE,F,遊戲,game,"['ro', '手遊', '遊戲']",0,0
238955191,一個陸娛小科普之群體追星與Solo追星？,本科普一樣比較偏向To.新粉或是迷茫自己屬性的追星人們，是的，我又來了，好久沒更版了哈哈，上次做了白嫖篇之後發現其實大家對這個詞反應還滿大的，所以這新的一篇就來講在陸娛追星時很常看到的《跟群還是Sol,"本科普一樣比較偏向To.新粉或是迷茫自己屬性的追星人們

是的，我又來了，好久沒更版了哈哈
上次做了白嫖篇之後發現其實大家對這個詞反應還滿大的，所以這新的一篇就來講在陸娛追星時很常看到的《跟群還是Solo》這個問題
P.S.沒有引戰的意思，歡迎各位底下交流心得
白嫖篇??
https://www.dcard.tw/f/china_star/p/237346718?cid=6110d948-0674-4b5a-8a40-5449a67a4905
（忘了直接引用前文了，就這樣看吧????）

（我是分隔線）

就...不知道什麼時候開始，粉圈的規則越來越多，已經不像以前那樣乾淨純粹和平聊天

「粉籍」這個詞相信追陸娛的你們都很熟悉吧？
看粉籍認姐妹也成為了現在追星的一大關卡
（由於又是另一個故事，所以挪到下篇科普說吧）

首先從群體追星說起吧：
有在用微博的你們，應該對粉絲群這個項目不陌生吧？
https://i.imgur.com/voXAIUu.jpg
就是上面這個??
所謂群體追星，就是跟著後援會啊~數據組啊~等等官方大粉去做事，比如：反黑，打榜，帶詞條轉帖，做數據，衝專輯銷量...等
然後在妳們的組織裡就都是同擔，唯就是唯，團就是團，不太會出現對家或者唯群有團粉，團群有唯粉的情況

那每個組織的加入要求也都不太一樣，有幾個愛豆的後援會有考慮到新粉，會幫新粉弄一個新粉專用，入群規定相對鬆一點的

舉個例子吧，像時團宋亞軒的群就有新生群，群規如下圖
https://i.imgur.com/73dPre9.jpg
那對比的話就是，純的唯粉群??
https://i.imgur.com/X0qONEQ.jpg
就會出現超話等級，唯粉，審核等等的需求

當然，一切都得看官後去設定標準，並不是每一家都是這樣

那群體追星具體是什麼操作呢？就是每天做完任務（數據，反黑等），回群裡回報，或者在官後或數據組的帖子底下回報，可能是一個“?”字，也可能是後援會規定的其他字。
（更淺顯易懂的話就是，學校老師派作業?你叫你寫完給家長簽名他會檢查同理）

那再來談到SOLO追星：
SOLO追星相對比較簡單，就是你接觸到的好友圈子裡不會只有你擔，唯可以跟團偏，團，甚至跨團，演員粉，混在同一個群組裡，然後你們的群聊中會穿插各個不同的愛豆，比如這邊一句蔡徐坤，那邊一句任國超，群聊內容就是愛豆大混戰但不會有人管你能不能提到這個愛豆，只是因為你們都有喜歡的一個共同對象而相聚

SOLO追星不用軍訓化的去每天完成任務回報，數據等想做的時候就做，不想做的時候稍稍偷懶也不會有人管你，就是一個放牛吃草式的追星風格

我本人選的是SOLO追星，看我卡稱不難看出來，我是海后式追星，多擔程度橫跨台中韓娛，基本上我飯的愛豆少說也有50+的人，基本上不可能群體追星...尤其是當音源榜衝榜，我如果多邊都群體，一天音源又只能投一個的話，我選擇哪個，都會成為其他幾個的眾矢之的，為了做好端水大師，群體追星這件事就跟我說掰掰了，對於群體追星做的那些，我也是今天這組明天那組，每天都在替不同人搞數據，有時候甚至可以一天搞兩組，是十分充實的SOLO追星生活哈哈哈

最後To.新粉
群體跟SOLO各有各的好，如果是群體，麻煩請自己學會判斷什麼是正確的追星價值觀，千萬不要官後小數或其他大粉說什麼就是什麼，有時候你跟到的大粉是脂粉，是毒一點的，請學會自己分辨，不要毫不猶豫的跟著跑，成為被虐粉的對象。
如果選擇SOLO，或多或少做一點小任務，可能愛豆被黑的時候幫忙反黑，愛豆出新專的時候帶詞條轉發之類的，不要完全什麼都不做，想著反正有群體的，畢竟多一份心多一份力。

今天的科普結束~
最後，祝大家追星愉快
https://sticker-assets.dcard.tw/images/d0764c8b-f751-44ed-a719-51fce3089b3f/orig.png",2022-05-21T22:43:40.286Z,FALSE,FALSE,F,中國明星,china_star,"['科普', '追星', '飯圈']",2,20
238955186,尋貓啟事,愛貓走失協尋??無晶片！無項圈！未結紮！，回家開門時貓咪溜出門後找不到了，姓名：咪嚕/男生，走失地點：三重區重新路三段115巷，靠近捷運菜寮站及過圳街，走失時間：5/21凌晨，特徵：橘毛、尖耳朵，尾巴帶,"愛貓走失協尋??無晶片！無項圈！未結紮！
回家開門時貓咪溜出門後找不到了

姓名：咪嚕/男生
走失地點：三重區重新路三段115巷，靠近捷運菜寮站及過圳街
走失時間：5/21凌晨
特徵：橘毛、尖耳朵，尾巴帶有白色條紋
個性：膽小怕生
聯絡資訊：0985945041 陳先生或直接私訊這隻臉書帳號
希望大家有任何消息可以馬上聯絡！非常感謝！

https://i.imgur.com/tyXl1Ni.jpg
https://i.imgur.com/FpJjBaC.jpg
https://i.imgur.com/OqVutMu.jpg",2022-05-21T22:40:39.478Z,FALSE,TRUE,F,寵物,pet,"['尋貓', '貓', '貓咪', '協尋']",3,4
238955183,#分享 來吧！營業中,越看越生氣欸，鬼鬼到底是在公主什麼啊?,"越看越生氣欸
鬼鬼到底是在公主什麼啊?",2022-05-21T22:39:03.460Z,FALSE,TRUE,M,Netflix,netflix,"['營運', 'Netflix']",4,2
238955182,#鴿子日常 一頁式廣告詐騙,-，一頁式廣告充斥！買防疫商品或快篩劑有詐！，一頁式廣告搭上時事熱賣商品，但購物欠缺保障，請留意?低於市價行情?、限時特價搶購?或號稱不滿意包退?等特徵。臺中市政府警察局關心您！，#反詐騙 #165專線 #第,"-
??一頁式廣告充斥！買防疫商品或快篩劑有詐！
一頁式廣告搭上時事熱賣商品，但購物欠缺保障，請留意??低於市價行情??、限時特價搶購??或號稱不滿意包退??等特徵。

https://i.imgur.com/uBXNrcb.png


https://www.facebook.com/193692360802182/posts/2010827172422016/

臺中市政府警察局關心您!



#反詐騙 #165專線 #第一分局 #大誠分駐所 # 宣導",2022-05-21T22:37:03.262Z,FALSE,FALSE,M,警察,police,[],1,7
238955178,謝謝妳愛過我,我愛你，只是人生中能讓我衝刺的最後一樣事情都滅掉了，所以只好到另一個世界去探索，我並沒有放棄自己 只是換另一種型態存在罷了，之前嘗試用安眠藥+降血壓藥+鎮定劑，結果讓妳以為我只是半夜尿床，今天我想在廁,"我愛你
只是人生中能讓我衝刺的最後一樣事情都滅掉了
所以只好到另一個世界去探索
我並沒有放棄自己 只是換另一種型態存在罷了
之前嘗試用安眠藥+降血壓藥+鎮定劑
結果讓妳以為我只是半夜尿床
今天我想在廁所BBQ 遺書跟證件都放在梳妝台
你要記得這平行時空裡還有愛著你的我
依然在你身邊守護著妳 祈求上帝保佑妳一帆風順
希望你能開心過完這一生 有機會的話再續今生緣",2022-05-21T22:32:31.924Z,TRUE,TRUE,F,心情,mood,[],3,2
