id,title,excerpt,content,createdAt,anonymousSchool,anonymousDepartment,gender,forumName,forumAlias,topics,commentCount,likeCount
239009931,在交友軟體中與獅子男曖昧，卻頻頻以心碎收場,第一次在Dcard版上發文，若寫得不好請多多包容並指教，我是獅子女，在過往經驗中只要配對到獅子男，都會很快的沉浸在曖昧粉紅泡泡氛圍中，總是有總心靈相通，知道對方下一步行為或反應，知己知彼的感覺太特別，,"第一次在Dcard版上發文，若寫得不好請多多包容並指教??

我是獅子女，在過往經驗中只要配對到獅子男，都會很快的沉浸在曖昧粉紅泡泡氛圍中，總是有總心靈相通，知道對方下一步行為或反應，知己知彼的感覺太特別，導致我次次淪陷在其中…
星座裡都說獅子座是外協的代表，但我個人並不同意此標籤，覺得內在心靈我更重視，只要身材不要超過100公斤，整體乾淨，長得如何我都無所謂，我也天真的認為獅子座的男性也是如此…但儘管我相信同類，結果卻沒有一個符合我的想法
在交友軟體上我幾乎是用隱藏相片的模式和人聊天，以交心為主，聊得不錯才會交換照片，而在遇到後面故事的男主前我幾乎都是聊一個禮拜內就會交換照片或是交換line或ig
當我遇到這一位獅子男時，一開始他和我提議說如果我們見面要不要直接見面不要預先傳照片，到約好的地點再猜猜找找看對方是誰，當時聽了覺得是一個有趣好玩又刺激的方式，於是我也答應了。後來我們就分享各自生活價值觀想法等彼此認識的過程，發現他的談吐是屬於慢慢溫溫熱熱的那種，會替我著想並尊重我的想法的人，不是那種強烈攻勢霸道控制欲讓人有壓力的，是我很喜歡的類型。突然有一天他暗示我他好奇我的長相，我當時沒有什麼安全感所以我們只交換張全身的身材照把臉馬掉，當時我感受到他對我的照片還挺滿意的，而我對他的照片只是覺得比我想像中的瘦??當時我沒有多做評論，後來的每一天我們聊的越來越曖昧，我也漸漸開始暈船了，開始會想他想知道他在幹嘛，一天結束會關心他，為了想要多一點的互動就算再累也會陪他熬夜聊天，前幾天他提出了要不要見面並問我的想法，我其實很想見他，但因為知道自己已經淪陷了所以很怕受傷，再加上最近疫情很危險呀，因此我以疫情關係想要足跡＆接觸的人單純點而拒絕了他，並說疫情好轉之後再見面這樣。老實說他這個邀約讓我開始心癢癢的，瘋狂想知道他長什麼樣子，也想知道他看到我的照片之後會是什麼想法，我抱著期待「他很不一樣 或許會跟我之前遇到的獅子男不同」昨晚就問了他“我們要不交換個照片嗎？” 隨後他就傳來了自拍，在我當下的眼裡「天啊 好好看哦??」我接著傳了我的照片，他回了“不差，蠻可愛的”，大概是我太敏感並未感受到他的開心與滿意，於是我就要他直說真實想法，不料我得到了似曾相似的回覆，他跟之前的獅男們一模一樣“我承認我是外貌協會，你並不是我喜歡的類型，但我們還是可以當朋友”，雖然我已經有做好心理建設了，但得到這樣的回覆，我還是心碎了?? 總總和他聊了一個半月，算算是相對較長時間的一位呢…
看來要獅子男看上我的外貌大概是不大可能的事了，次次碰壁，不過我並不怪他們，因為感情不能強求 不能勉強 更沒有分誰對誰錯，這些經驗只告訴我一件事，不能天真的以為或期待對方是自己想像的樣子。

希望自己未來可以遇見一個可以真正懂我並接納我的另一半，看到最後的卡友們祝福各位有情人終成眷屬 無情人早日脫單?? 感謝各位看完整篇文章啦??",2022-05-27T21:18:24.975Z,FALSE,TRUE,F,星座,horoscopes,"['獅子', '交友', '感情', '曖昧', '星座']",6,5
239009929,該不該離職,我目前工作快兩個月，還是覺得很不適應，公司商品跟本身讀的科系大不相同，學習起來十分痛苦，以及部門只有我跟經理兩個人，沒有其他同事，工作環境非常安靜，打字鍵盤的聲音都很清楚。而我每次有事情要問經理，他都,"我目前工作快兩個月，還是覺得很不適應，公司商品跟本身讀的科系大不相同，學習起來十分痛苦，以及部門只有我跟經理兩個人，沒有其他同事，工作環境非常安靜，打字鍵盤的聲音都很清楚。
而我每次有事情要問經理，他都會說不要問他，自己想辦法，但我按照自己的方法做之後，又叫我不要自作主張，問他再決定要怎麼做?？
再來是我請假還會被罵，我頭痛請假還會被問是不是裝病，被罵說「你請假事情都變我在做了，那我請你來幹嘛」，但我只請1天??",2022-05-27T21:17:54.737Z,TRUE,TRUE,M,工作,job,['離職'],7,4
239009923,喜歡趴趴的兔兔??,第一次覺得我家兔兔好可愛（： 喂～??，好啦好啦，你吃大便時也可愛??，標題的趴趴是指趴著，想歪的自首唷，我家的早已成為公公了????，這個涼墊美賣唷，兔兔很喜歡趴在上面監視我玩電腦，歡迎各位兔奴才 蓋個兔兔,"第一次覺得我家兔兔好可愛(??: 喂～??
好啦好啦，你吃大便時也可愛??
https://i.imgur.com/pkW9ees.jpg
標題的趴趴是指趴著，想歪的自首唷??
我家的早已成為公公了??????
這個涼墊美賣唷，兔兔很喜歡趴在上面監視我玩電腦
https://i.imgur.com/xFC6Rri.jpg
歡迎各位兔奴才 蓋個兔兔趴趴大樓",2022-05-27T21:14:40.493Z,FALSE,TRUE,M,寵物,pet,"['兔', '兔子', '毛小孩', '喜歡']",9,35
239009920,好好告別是對感情最好的尊重,即使到了要分開那一步，也要坦然告別，才不愧對在一起時所經歷的一切,"即使到了要分開那一步
也要坦然告別
才不愧對在一起時所經歷的一切",2022-05-27T21:13:31.671Z,FALSE,TRUE,F,感情,relationship,"['感情', '分手', '價值觀']",0,3
239009911,#詢問 請幫忙推薦賣家或關鍵字??,我是一位肉肉的女生 163.3/67 平常穿著比較休閒衣服都是T恤圓領，最近想找比較夏天繽紛（BV綠/橘/黃）或套裝或設計感的衣服褲子，但搜出來的都很普通，大家可以推薦蝦皮/淘寶賣家或搜尋關鍵字嗎，很,"我是一位肉肉的女生 163.3/67 平常穿著比較休閒衣服都是T恤圓領
最近想找比較夏天繽紛（BV綠/橘/黃）或套裝或設計感的衣服褲子
但搜出來的都很普通??
大家可以推薦蝦皮/淘寶賣家或搜尋??關鍵字嗎??

https://i.imgur.com/ofTGpUt.jpg
很喜歡這件褲子 但關鍵字不知道要搜尋什麼

https://i.imgur.com/WylAHmP.jpg
https://i.imgur.com/LsnSXtv.jpg
https://i.imgur.com/JFkhEfW.jpg
https://i.imgur.com/l2JB7Es.jpg
顏色很可愛 但不敢穿小可愛",2022-05-27T21:07:39.309Z,FALSE,TRUE,F,穿搭,dressup,"['推薦', '賣家', '關鍵字', '穿搭', '蝦皮']",0,0
239009908,抖音,不知道有沒有人跟我一樣很喜歡滑抖音，但是每次滑一滑都會突然很自卑，看到很多比我還小的女生，都長的很漂亮身材很好瘦大奶那種，2007 2006的 怎麼有辦法那麼好看，（我那個年紀都還在看卡通23台），就,"不知道有沒有人跟我一樣很喜歡滑抖音

但是每次滑一滑都會突然很自卑

看到很多比我還小的女生

都長的很漂亮身材很好瘦大奶那種

2007 2006的 怎麼有辦法那麼好看

（我那個年紀都還在看卡通23台）


就算模仿妝容也不會一樣好看

不知道有沒有人跟我一樣……",2022-05-27T21:06:06.740Z,TRUE,TRUE,F,女孩,girl,['抖音'],1,3
239009905,電台廣播工作,最近找到了一份工作，是某家廣播電台，蠻知名的，上網查了很多資料，可是沒有看到關於那家的評價（員工），只有面試趣，但因為我沒有積分所以無法看??，我是去年畢業的，也不是本科系，沒有相關經驗，但卻被錄取了,"最近找到了一份工作
是某家廣播電台，蠻知名的
上網查了很多資料
可是沒有看到關於那家的評價（員工）
只有面試趣
但因為我沒有積分所以無法看??

我是去年畢業的
也不是本科系，沒有相關經驗
但卻被錄取了
是朋友先去面試告訴我覺得不錯然後請我去
面試完隔天就電話通知錄取我了
也蠻快就要上工了
因為常常看到板上說隔天錄取很多是屎缺
我也蠻怕的
https://sticker-assets.dcard.tw/images/d93e9c82-4969-4e74-828d-39c5f28c56c6/orig.png
所以想問看看在電台工作的人
我是上了企劃執行
但好像多數負責執行（面試談到的）
聽起來是不錯、有趣的工作
想知道在電台工作推薦嗎????

我查了三天的資料了
但想聽聽實際在電台上班的人
會推薦在電台上班嗎？
有什麼需要注意的？
雖然面試有問工作內容
但說得有點籠統??
怕面試說那樣，結果進去的又不一樣

另外
有時候我就很好奇為什麼不錯的工作
可是有一種很缺人的感覺...？",2022-05-27T21:05:46.125Z,TRUE,TRUE,F,工作,job,"['工作', '面試', '廣播']",5,5
239009903,好玩遊戲每天要玩,S10幾顆一路開跌囉真開心，傳說遺照，再見了好遊戲,"S10幾顆一路開跌囉真開心
傳說遺照
再見了好遊戲

https://i.imgur.com/b4vSD5o.jpg",2022-05-27T21:04:07.360Z,FALSE,TRUE,M,傳說對決,aov,"['好玩', '遊戲', '傳說對決', '傳說對決板']",6,2
239009896,男友沒做到約定好的事情好失望?,跟男友有約定好，如果工作場合有加異性IG，要跟對方報備一下，結果今天發現他跟一個女生互追，我問他他才說?，他說這女生在他剛進公司時其實就認識了，最近女生來加他IG的 而且也知道他有女友，後來我問還有別,"跟男友有約定好，如果工作場合有加異性IG
要跟對方報備一下
結果今天發現他跟一個女生互追
我問他他才說?
他說這女生在他剛進公司時其實就認識了
最近女生來加他IG的 而且也知道他有女友
後來我問還有別的嗎？
才說一個月前也有一個
並給我看了女生的IG
老實說我不怕他跟這些女生亂搞什麼的
我是相信他的 也覺得他值得相信
但他事後的態度讓我很失望?
他講完之後說怎麼感覺我很不信任他
可以不要覺得他都會跟別人亂搞嗎
明明就是他先沒做到說好的事
怎麼反過來說我呢?
我說我在乎的是沒說到做到
讓他立場倒過來想一下
他說他也會不開心
並跟我說XX（我的綽號）Sorry
後來他再傳訊息 問我還會生氣嗎
就說他累了想睡覺
我其實覺得不是應該要承諾說
以後不會忘記 會做到 這種話
就他讓我感覺 他覺得自己沒有做錯什麼事
只是犯了點小錯誤
這事後的態度比較是我主要傷心的原因?
是我真的太刁鑽嗎？請問你們覺得要怎麼溝通會比較好呢？
（不考慮分手建議 謝謝）",2022-05-27T20:59:27.034Z,TRUE,TRUE,F,感情,relationship,"['感情', '愛情', '男友']",4,2
239009884,#閒聊 該讀書囉,不覺得幾十隻書一起在叫很好聽ㄇ，另一張，娛樂賽強化：一次跑出7隻，福利熊迴響+破心術偷到對手的三書：數量再x2，所以一次最多可以跑出14隻，估計對手是黑人問號了一下，好啦我只想說，竊書不能算偷....,,2022-05-27T20:55:20.074Z,FALSE,TRUE,M,哈利波特：魔法覺醒,harrypottermagicawakened,[],8,32
239009883,#找 至少15年前的感人動畫,很感人很好哭沒記錯的話是電影 忘記是妹妹還是媽媽生重病然後最後是微笑著死掉的 有人神的出來嗎??,"很感人很好哭沒記錯的話是電影 忘記是妹妹還是媽媽生重病然後最後是微笑著死掉的 有人神的出來嗎??
https://sticker-assets.dcard.tw/images/d417f1d1-22b9-4e19-a4e3-13ead086d78f/orig.png",2022-05-27T20:55:17.015Z,FALSE,TRUE,F,動漫,acg,[],2,0
239009881,記錄,2015年06月，順利從大學畢業，剛畢業的我，對於選擇怎樣的行業很茫然，當時，成績又差，有多差？大概就是大學四年 主科被當了14科那樣差，你說 會找的到工作嗎？ 曾經我也以為不會，然而，2015年06,"2015年06月
順利從大學畢業
剛畢業的我，對於選擇怎樣的行業很茫然
當時，成績又差，有多差？
大概就是大學四年 主科被當了14科那樣差
你說 會找的到工作嗎？ 曾經我也以為不會
然而
2015年06月
很幸運 有間事務所願意給我機會
當時的主管是屬於媽媽??型主管
只要我們敢問，他就敢教
至於同事，雖然事務所很忙，但是只要我求助
同事總是會很溫柔的教導

2017年07月
從事務所離職了
還記得，當時的主管一直叮嚀我
去到別家公司記得要「多聽、多看、少說話」
深怕管不住嘴的我，到其他地方會被欺負

2017年08月
進了飯店業
還記得進去的前幾個禮拜
什麼事情都沒有
閒到我發慌，閒到我想離職
幸好的是
有位剛到職幾個禮拜的同事不做了
而我剛好接他的缺
開始了我的飯店人生
當時的主管給我的感覺是 啥也不管的主管
只要你事情做完，想幹啥都行

2020年02月
肺炎開始炸裂了
飯店業也是被衝擊的產業之一
生意每況愈下
到後期，基本上每個部門都被要求放無薪假
很幸運的是，我的部門沒有

2020年09月
跟主管提離職

2020年11月
從飯店業畢業
當時的我，只想找個比較不會受疫情影響的產業

2020年12月
撞進遊戲產業
由於是新創公司
很多東西沒有以前可以參考
也是因為如此
很多東西要跟同事討論、溝通然架設及協助架設
很幸運的是 同事是一群天真無邪的小天使
然而 剛進去的我
其實是有點不知所措的
原因 同事太熱情奔放了?????！
而我，已經找不回以前的熱情了
再者，當時的主管
是個性上較謹慎 嚴肅的人
沒有不好
但 同間辦公室
我其實內心壓力很大

2021年05月
我的主管離職了！
其實，我當時是既緊張又有點小確幸的
很矛盾

2021年05月
新主管上位
新主管給我的感覺 像風又像海
感覺他的知識像海一樣廣闊
想法像海一樣深不可測
也像風一樣捉摸不透
而且也是願意放手讓我們去做去闖

2022年04月初
令人惋惜的是
新主管也離職了

2022年04月初
公司上層大變動

2022/04月中
我的部門被解散了
而我
也失業了。

從2015年到現在，我歷經了三份工作，面對過四位主管以及各式各樣的同事，以前常常聽到朋友抱怨，抱怨同事不好，抱怨公司哪裡有問題，在求職路上，相對於很多人來說，我真的很幸福。",2022-05-27T20:55:03.732Z,TRUE,TRUE,F,心情,mood,[],0,4
239009875,當女孩很累人的，琴棋書畫都要會?????,,https://megapx-assets.dcard.tw/videos/9460340f-6c76-48b3-943b-9a8889882013/orig,2022-05-27T20:52:21.219Z,FALSE,FALSE,F,音樂,music,"['女孩', '閒聊', '音樂創作', '推薦', '尋找']",3,2
239009871,18歲那年（著迷）,：哩洗勒衝啥啦！出來了啦！，我媽在廁所外大喊著我的名字，他完全不知道女兒今天可是要假借讀書去約會呢！，我在廁所梳妝打扮至少快一小時多了，難怪我媽會這麼氣，雖然說是讓老師當我的家教但怕我爸媽覺得奇怪最後,"：哩洗勒衝啥啦！出來了啦！
我媽在廁所外大喊著我的名字
他完全不知道女兒今天可是要假借讀書去約會呢！
我在廁所梳妝打扮至少快一小時多了，難怪我媽會這麼氣????

雖然說是讓老師當我的家教但怕我爸媽覺得奇怪最後還是選擇在附近的摩斯溫習功課（約會）
我老早就在那等她了，這比每場籃球比賽還來的緊張…
我看到機車後視鏡出現了她的身影，還故意擺了一個很帥的pose 等她走來我這
：我讓你等很久嗎？
妳急忙的走了過來
：我前一天就在這裡等了…????
：不要給我在那邊浮誇！

老師穿了一件小背心外面搭了一件白罩衫，褲子則穿了一件緊身的牛仔褲，完全突顯了她的身材。
妳只點了一杯美式咖啡一份沙拉，我想這就是妳維持完美體態的飲食方式。

妳坐在我的對面優雅的吃著沙拉，我從來沒想過有一天能夠和全校最兇的老師坐在摩斯悠閒、愜意的共同享受著摩斯～
正當我還在自豪著我有這般幸福的待遇時，我不小心喝到了老師的咖啡，
：幹sorry 喝錯了啦！??
：沒關係啦我們兩個分什麼彼此呢
（致命的微笑再度來襲??
這麼會撩人的妳怎麼會是母胎呢？
我不經在腦海中浮現了這個問題
：欸老師，妳有交過男朋友嗎？
妳笑了一下
：為什麼突然這樣問我呢？
：依我女人的第六感，妳看起來會受到許多男生們的歡迎啊！不要說男生了女生們也會…????
：那我有受到你的歡迎嗎？
我停頓了一下，
：為什麼每次都反被妳問啊！
：哈哈哈哈哈哈哈哈哈快點拿出英文課本啊
我們今天出來的目的不是就是要好好惡補你沒救的英文嗎？
（每次講話都超賤超直的！！????）

我根本沒心在英文上，我時不時都會偷瞄妳一下，妳是那麼的認真教導我，而我是如此認真的看著妳
我很確定我已經愛妳愛到走火入魔了。
那天有一半的時間我們都在聊天，
我們什麼話題都可以聊，家庭、學校和未來所有的生活鎖事，看得出妳很努力想把我拉回上課哈哈哈哈哈哈哈哈哈

那個時候時間差不多在晚上六七點，我們離開了摩斯。「仙履奇緣」這部電影才剛上映沒多久，也不知道哪來的勇氣，詢問了Kristin ，
: 欸老師妳知道最近剛上映的仙履奇緣嗎？感覺很好看欸
：我知道啊，凱特布蘭琪演的那個壞繼母嗎？
我心想: 喔wow ????老師連凱特布蘭琪都知道，凱特可是部分蕾絲邊都著迷的女王欸！
：那個…妳想現在去看嗎？
：妳下禮拜可是要考模擬考的人欸，還不快點回家讀其他科！
：我在這向妳保證，我某某某平均每科成績絕不會低於80分????
：是這樣嗎？真拿你沒轍欸…走吧！離這邊最近的國賓在哪啊？
：我為您帶路吧！

就這樣我上了老師的車，Kristin 的行情果真的好，開了一輛奧迪。
我們像同齡的朋友相約去看電影似的，一路上有說有笑，討論著要什麼爆米花什麼飲料。我幫她買單，我告訴她下次再由她請我吧！（想要再賺到一次約會很心機吧我哈哈哈哈哈哈哈????）
回想起那天，電影的內容倒是沒什麼印象，只記得部分的時間目光都在坐我右邊的妳，吃爆米花的時候，時不時都會不小心抓到妳的手，妳就會偷偷瞪了我一下????。

回程的路上，我看著車窗外，滿是不捨。妳似乎看出了我有心事，
：幹嘛啊陪你來看電影還不開心嗎？
：沒有啦只是想到回家還要看書好累欸
（其實是想到要跟妳分開了好難過。）
：我今天很開心
我看向了正在開車的妳，發現妳也正往我這邊瞄了一眼，
：欸對了你幫我從後坐拿個東西好嗎
：喔好啊
正當我伸手往後拿時，我看到後座有一件背號15的球衣和一雙籃球鞋，我的心瞬間碎了一地。
：給你。
：謝謝啊幫我放你那邊的地板上就好了
：那個…我在這下車就好了老師沒關係
：不用送你到家嗎？
：我突然想到我還要去領貨啦！老師你等等開車小心點喔！
：那你到家講一聲掰掰囉

一個人走在路上，不經回想到，那時問Kristin 有沒有男友時，為什麼她不正面回我的原因了。答案大概就是有吧，身為一個老師或許還是不想跟一個學生透露太多的隱私。
回到家，我爸摸了我的頭稱讚我讀書讀這麼晚辛苦了，害我多少有點過意不去????

打開手機收到了一封來自Kristin 的簡訊，
：不開心嗎？


續….

很開心大家喜歡我的高中故事！希望大家可以多多留言很喜歡你們給我的回應不管好與壞
有人問說老師是什麼星座，她是天蠍座的美魔女啊",2022-05-27T20:50:22.653Z,TRUE,TRUE,F,彩虹,rainbow,"['感情', 'Les', '師生戀']",13,38
239009869,有人知道這是什麼嗎??,看過醫生，第一間說是汗皰疹，第二間說是病毒疣?,"https://i.imgur.com/lpK6swY.jpg
https://i.imgur.com/pWPL1ZM.jpg
看過醫生，
第一間說是汗皰疹，第二間說是病毒疣??",2022-05-27T20:49:45.060Z,TRUE,TRUE,F,心情,mood,"['汗皰疹', '病毒疣', '腳底']",12,9
239009868,5萬6 組3070跟32寸1000r曲面全配（螢幕+主機+滑鼠鍵盤）,這種配置你怎麼說,"https://i.imgur.com/CRugPaz.jpg
這種配置你怎麼說",2022-05-27T20:49:30.066Z,FALSE,FALSE,M,3C,3c,"['電腦', '開箱', '網路', '電競', 'iPhone']",2,0
239009867,網路正妹觀察,引文的立場滿偏頗的，如果就照片類型來看，我自己對網路正妹的觀察大致可以分為三種，第一種是需要關注度的網美/網紅類型，撇除一些沒內涵只是想紅、過度修圖的歪瓜劣棗，這種女生通常是真的長得滿漂亮的，一般生活,"引文的立場滿偏頗的
如果就照片類型來看
我自己對網路正妹的觀察大致可以分為三種

第一種是需要關注度的網美/網紅類型
撇除一些沒內涵只是想紅、過度修圖的歪瓜劣棗
這種女生通常是真的長得滿漂亮的
一般生活照、攝影照、自拍照都會放
不會特別偏重哪種類型
但自己一定會出現在照片中
很少發沒有人的照片

第二種是不算特別美但愛拍照的類型
這種女生可能稱不上正妹
但外貌一定有中上且耐看
通常個性比較活潑
常放出遊或參加活動的照片
一定會特別set過
妝髮、穿搭、取景、角度、色調都有用心

第三種是隱藏版正妹
通常是清新自然、氣質或有點鬼靈精怪的類型
不會特別常放自己的照片
但因為隨便拍都好看
所以風格也比較隨意
頭貼一定不會是自拍照
就算是也可能故意搞怪扮醜
如果是放卡通、動漫人物有高機率是這種正妹

至於長得比較普的女生(實在不想用醜妹這個詞，人人都有機會靠後天努力變成第二種類型！)
頭貼也很少會是自拍照
比較常是精挑細選過的半身、側身照
大概是覺得還不錯但不會多看兩眼的程度

至於完全不放自己的照片的人
說句公道話
可能是比較害羞或沒自信
也不見得長得不好看啦",2022-05-27T20:48:57.620Z,FALSE,TRUE,F,閒聊,talk,[],6,12
